{"$schema":"https://json-schema.org/draft/2020-12/schema","$id":"rules-profile.schema.json","type":"object","required":["profile_id","edition","language","sources","capabilities"],"properties":{"profile_id":{"type":"string"},"edition":{"const":"7e"},"language":{"const":"ja"},"sources":{"type":"array","items":{"type":"object","required":["id","kind","pages"],"properties":{"id":{"type":"string"},"kind":{"enum":["official_quick_start","core_rulebook","scenario"]},"pages":{"type":"string"}}}},"capabilities":{"type":"object","additionalProperties":{"enum":["verified","scenario_local","core_rule_check_required","keeper_ruling_required","unsupported"]}}}}
