{"profile_id":"coc7e_quick_start_2016_ja","edition":"7e","language":"ja","sources":[{"id":"NewCoC-QS_200228","kind":"official_quick_start","pages":"7-20"}],"capabilities":{"quick_start_creation":"verified","core_resolution":"verified","combat_quick_start":"verified","sanity_quick_start":"verified","full_creation":"core_rule_check_required","luck_spending":"core_rule_check_required","chase":"core_rule_check_required","downtime":"core_rule_check_required"}}
